{
  "image": "Aldil.png",
  "name": "Aldil",
  "shortDescription": "Association Lyonnaise pour le DÃ©veloppement de l'Informatique Libre",
  "tags": [
    "Libre",
    "Opensource"
  ],
  "patternsGoogleCalendar": [
    "Aldil"
  ],
  "socialLinks": [
    {
      "url": "http://aldil.org"
    },
    {
      "url": "https://twitter.com/aldil_lyon"
    }
  ]
}
