{
  "image": "MaxSessionsLyon.png",
  "name": "Max Sessions Lyon",
  "shortDescription": "Nous sommes un collectif passionné, dédié à l'excellence dans le développement, le software craftsmanship, la technologie et l'innovation en management.\n Notre mission est de créer un espace où professionnels, novices, et curieux peuvent se rencontrer, échanger, et grandir ensemble.\n Max Session vise à devenir un carrefour d'échange et d'apprentissage pour tous ceux qui partagent une passion pour la technologie et l'innovation en management.\n Notre but est de construire une communauté solide et engagée, capable de pousser les limites de ce que nous savons et de ce que nous pouvons faire ensemble.\n Que vous soyez développeur, chef de projet, designer UX/UI, entrepreneur tech, ou simplement intéressé par le monde du développement et de l'innovation managériale, vous trouverez votre place parmi nous.",
  "tags": [
    "Craftsmanship",
    "Software Engineering",
    "Development",
    "Management",
    "DevOps",
    "Cloud",
    "Product",
    "Design",
    "Agile",
    "Architecture"
  ],
  "patternsGoogleCalendar": ["Max Sessions Lyon", "maxsession-lyon"],
  "socialLinks": [
    {
      "icon": "fas fa-link",
      "tooltip": "Blog",
      "url": "https://blog.maxds.fr/"
    },
    {
      "icon": "fas fa-calendar",
      "tooltip": "Meetup",
      "url": "https://www.meetup.com/maxsession-lyon"
    },
    {
      "icon": "fab fa-youtube",
      "tooltip": "Youtube",
      "url": "https://www.youtube.com/channel/UC4oL-CO7XCLgHZCqisxOi6w"
    }
  ],
  "slackChannels": ["#maxsession_meetup"]
}
