{
  "image": "DockerLyon.png",
  "name": "Docker Lyon",
  "shortDescription": "Les meetups Docker Lyon sont l'occasion de se retrouver et d'echanger autour de Docker, la technologie de containerisation",
  "tags": [
    "Docker"
  ],
  "patternsGoogleCalendar": [
    "DockerLyon"
  ],
  "socialLinks": [
    {
      "icon": "fas fa-link",
      "tooltip": "Web site",
      "url": "http://www.meetup.com/Docker-Lyon/"
    }
  ]
}
