{
  "image": "SoftwareCraftsmanshipLyon.png",
  "name": "Software Craftsmanship Lyon",
  "shortDescription": "La communauté Software Craftsmanship Lyon réunit les développeurs, sans sexisme, élitisme ni langage ou techno obligatoire.",
  "tags": [
    "Craftsmanship",
    "artisan",
    "Coding Dojo"
  ],
  "patternsGoogleCalendar": [
    "Software Craftsmanship Lyon",
    "SWCrafters"
  ],
  "socialLinks": [
    {
      "icon": "fas fa-link",
      "tooltip": "Web site",
      "url": "http://www.meetup.com/fr/Software-Craftsmanship-Lyon/"
    },
    {
      "icon": "fas fa-calendar",
      "tooltip": "Meetup",
      "url": "http://www.meetup.com/fr/Software-Craftsmanship-Lyon/"
    },
    {
      "icon": "fab fa-twitter",
      "tooltip": "Twitter",
      "url": "http://www.twitter.com/swcraftlyon"
    }
  ],
  "slackChannels": [
    "#swcrafts_meetup"
  ]
}
