{
  "image": "GolangLyon.png",
  "name": "Golang Lyon",
  "shortDescription": "Ce groupe s'adresse à toute personne s'intéressant de près ou de loin au langage Go : curieux, débutants ou personnes expérimentées !",
  "tags": [
    "Go",
    "Golang"
  ],
  "patternsGoogleCalendar": [
    "Golang Lyon",
    "GolangLyon"
  ],
  "socialLinks": [
    {
      "icon": "fas fa-link",
      "tooltip": "Web site",
      "url": "http://www.meetup.com/Golang-Lyon/"
    },
    {
      "icon": "fab fa-twitter",
      "tooltip": "Twitter",
      "url": "https://twitter.com/GolangLyon"
    }
  ]
}
