{
  "image": "IppEventsLyon.svg",
  "name": "IppEvents Lyon",
  "shortDescription": "Chez Ippon Technologies, on aime partager et échanger autour des nouvelles technologies.\nNous organisons des évènements et invitons régulièrement des experts afin de découvrir et comprendre les dernières innovations.\n\nRejoignez-nous à l'occasion de nos IppEvents :)",
  "tags": [
    "Craftsmanship",
    "Software Engineering",
    "DATA",
    "DevOps",
    "Cloud",
    "Product",
    "Design",
    "Agile",
    "Architecture"
  ],
  "patternsGoogleCalendar": [
    "IppEvents"
  ],
  "socialLinks": [
    {
      "icon": "fas fa-link",
      "tooltip": "Blog",
      "url": "https://blog.ippon.fr/"
    },
    {
      "icon": "fas fa-calendar",
      "tooltip": "Meetup",
      "url": "https://www.meetup.com/fr-FR/ippevents-lyon/"
    },
    {
      "icon": "fab fa-twitch",
      "tooltip": "Twitch",
      "url": "https://www.twitch.tv/ippontech"
    },
    {
      "icon": "fab fa-youtube",
      "tooltip": "Youtube",
      "url": "https://www.youtube.com/@ippontechtv"
    }
  ],
  "slackChannels": [
    "#ippevents"
  ]
}
