{
  "image": "AFUPLyon.png",
  "name": "AFUP Lyon / Apéros PHP",
  "shortDescription": "L'AFUP Lyon organise des apéros, ateliers, rendez-vous autour des dernières avancées du langage PHP.",
  "tags": [
    "PHP",
    "AFUP",
    "Symfony",
    "Laravel"
  ],
  "patternsGoogleCalendar": [
    "Apéro PHP",
    "AFUP"
  ],
  "socialLinks": [
    {
      "url": "https://www.meetup.com/fr-FR/afup-lyon-php/"
    },
    {
      "url": "https://twitter.com/AFUP_lyon"
    },
    {
      "url": "https://www.linkedin.com/company/afup-lyon/"
    },
    {
      "url": "https://www.github.com/afup"
    }
  ]
}
