{
  "image": "LaboratoireOuvertLyonnais.svg",
  "name": "Laboratoire Ouvert Lyonnais",
  "shortDescription": "Le Laboratoire Ouvert Lyonnais est un hackerspace proposant un espace pour sa communauté afin de réaliser et accompagner des projets, apprendre et partager des connaissances ou des technologies (peu importe le domaine), le tous dans la joie et la bonne humeur",
  "tags": [
    "Open source",
    "Électronique",
    "Informatique",
    "Hacking",
    "Ethical Hacker",
    "DIY",
    "Projets",
    "Hackerspace",
    "Bidouilles",
    "Apprendre",
    "Échange",
    "Partage",
    "Rencontre"
  ],
  "patternsGoogleCalendar": [
    "LaboratoireOuvertLyonnais"
  ],
  "socialLinks": [
    {
      "icon": "fas fa-link",
      "tooltip": "Web site",
      "url": "https://labolyon.fr"
    },
    {
      "icon": "fab fa-meetup",
      "tooltip": "Groupe Meetup",
      "url": "http://www.meetup.com/fr/Laboratoire-Ouvert-Lyonnais/"
    },
    {
      "icon": "fas fa-code-branch",
      "tooltip": "Git Forge",
      "url": "https://git.labolyon.fr/"
    },
    {
      "icon": "fab fa-weixin",
      "tooltip": "IRC",
      "url": "irc://irc.geeknode.org/labolyon"
    },
    {
      "icon": "fab fa-twitter",
      "tooltip": "Twitter",
      "url": "https://twitter.com/LaboLyon"
    }
  ]
}
