{
  "image": "HumanTalks.png",
  "name": "Human Talks Lyon",
  "shortDescription": "Des talks de 10 minutes accessibles à tous, pour découvrir des sujets techs variés et partager ses passions. Tous les 2nds mardi du mois partout en France et à Lyon en particulier !",
  "tags": [],
  "patternsGoogleCalendar": [
    "Human Talks",
    "HumanTalks"
  ],
  "socialLinks": [
    {
      "url": "http://humantalks.com/cities/lyon"
    },
    {
      "url": "https://www.meetup.com/HumanTalks-Lyon/"
    },
    {
      "url": "https://www.twitter.com/HumanTalksLyon"
    }
  ]
}
