{
  "image": "AFPy.png",
  "name": "Rencontres Python",
  "shortDescription": "Une rencontre Python est un moment où les développeurs et développeuses se retrouvent autour d'un verre et d'une présentation pour échanger autour de ce langage. L'accès est gratuit et ouvert à tous. Cet événement est organisé par l'Association Francophone Python (AFPY).",
  "tags": [
    "Python",
    "DevOps",
    "Scientific",
    "Web"
  ],
  "patternsGoogleCalendar": [
    "Python",
    "AFPY"
  ],
  "socialLinks": [
    {
      "url": "http://www.afpy.org"
    },
    {
      "url": "https://www.meetup.com/fr/Python-AFPY-Lyon/"
    },
    {
      "url": "https://twitter.com/python_lyon"
    },
    {
      "url": "https://www.github.com/AFPy"
    }
  ]
}
