{
  "image": "LyonDataViz.png",
  "name": "Lyon DataViz",
  "shortDescription": "Echange de pratiques, id√©es et outils autour de la Data Visualization",
  "tags": [
    "Dataviz",
    "D3.js",
    "JavaScript",
    "Visualisation",
    "Visual Analytics",
    "Design"
  ],
  "patternsGoogleCalendar": [
    "Lyon DataViz",
    "LyonDataViz"
  ],
  "socialLinks": [
    {
      "icon": "fas fa-link",
      "tooltip": "Web site",
      "url": "http://www.meetup.com/Lyon-Dataviz/"
    },
    {
      "icon": "fab fa-twitter",
      "tooltip": "Twitter",
      "url": "https://twitter.com/LyonDataViz"
    },
    {
      "icon": "fab fa-github",
      "tooltip": "Git Hub Organization",
      "url": "https://github.com/LyonDataViz/"
    }
  ]
}
