{
  "image": "lyongamedev.png",
  "name": "LyonGameDev",
  "shortDescription": "Les brasseurs du jeu-vidéo lyonnais. Bières, pitchs et gros pixels... Pour l'instant c'est avant tout une rencontre mensuelle, mais cela peut devenir bien plus encore !",
  "tags": [
    "GameDev",
    "Jeu vidéo",
    "Game",
    "Video Game"
  ],
  "socialLinks": [
    {
      "url": "http://lyongamedev.pro"
    },
    {
      "url": "https://twitter.com/lyon_dev"
    },
    {
      "url": "https://www.linkedin.com/company/lyongamedev/?viewAsMember=true"
    },
    {
      "url": "https://www.facebook.com/LyonGameDevPage/"
    },
    {
      "url": "https://github.com/lyongamedev"
    }
  ]
}
