{
  "image": "TheNEO.png",
  "name": "The Next Entreprise Organisation",
  "shortDescription": "Les nouvelles formes d'organisations",
  "tags": [
    "Agile",
    "Lean",
    "Organisations liber√©es"
  ],
  "patternsGoogleCalendar": [
    "TheNEO"
  ],
  "socialLinks": [
    {
      "url": "https://www.meetup.com/fr-FR/theneo/"
    }
  ]
}
