{
  "image": "CafeDevOpsLyon.png",
  "name": "Café DevOps Lyon",
  "shortDescription": "Echanges visant à progresser sur les aspects opérationnels cloud, déploiement continu et scalabilité des infrastructures.",
  "tags": [
    "Cloud",
    "Operation",
    "Infrastructure",
    "Déploiement continu",
    "Resilience"
  ],
  "patternsGoogleCalendar": [
    "Café DevOps Lyon",
    "CafeDevOpsLyon"
  ],
  "socialLinks": [
    {
      "url": "https://cafedevops.org"
    },
    {
      "url": "https://www.meetup.com/fr-FR/cafe-devops-lyon/"
    },
    {
      "url": "https://twitter.com/CafeDevOpsLyon"
    }
  ]
}
