{
  "image": "LYAUG.png",
  "name": "Lyon Android User Group",
  "shortDescription": "Le Google Developer Group (GDG) Lyon Android, alias #LYAUG est une association visant à regrouper les professionnels et les développeurs Android/Google de Lyon et de la région Rhône-Alpes lors de différents évènements.",
  "tags": [
    "Android",
    "Google"
  ],
  "patternsGoogleCalendar": [
    "Lyaug",
    "GDG"
  ],
  "socialLinks": [
    {
      "icon": "fab fa-meetup",
      "tooltip": "Meetup",
      "url": "https://www.meetup.com/Lyon-Android-User-Group-LYAUG/"
    },
    {
      "icon": "fab fa-twitter",
      "tooltip": "Twitter",
      "url": "https://twitter.com/LyonAndroidUG"
    }
  ]
}
