{
  "image": "LyonDataScience.png",
  "name": "Lyon Data Science",
  "shortDescription": "Communauté d'échange et apprentissage autour des Data Science et machine learning à Lyon",
  "tags": [
    "Elasticsearch"
  ],
  "patternsGoogleCalendar": [
    "Lyon Data Science",
    "LyonDataScience"
  ],
  "socialLinks": [
    {
      "icon": "fas fa-link",
      "tooltip": "Web site",
      "url": "http://www.lyondata.science"
    },
    {
      "icon": "fab fa-twitter",
      "tooltip": "Twitter",
      "url": "https://twitter.com/LyonDataScience"
    },
    {
      "icon": "fab fa-facebook",
      "tooltip": "Facebook",
      "url": "https://www.facebook.com/pages/Lyondatascience/503525249798412?ref=tn_tnmn"
    },
    {
      "icon": "fab fa-github",
      "tooltip": "Git Hub Organization",
      "url": "https://github.com/lyondatascience"
    }
  ]
}
