{
  "image": "AFSYSfPots.png",
  "name": "AFSY SfPots",
  "shortDescription": "L'AFSY organise les SfPots, des apéros décontractés autour du framework PHP Symfony",
  "tags": [
    "PHP",
    "Symfony",
    "AFSY-SfPots"
  ],
  "socialLinks": [
    {
      "url": "https://www.meetup.com/afsy-sfpot/"
    }
  ]
}
