{
  "image": "MUGLyon.png",
  "name": "MTG Lyon",
  "shortDescription": "Le MTG Lyon (anciennement MUG Lyon) regroupe les passionnés des technologies Microsoft et affiliées. Un événement par mois est organisé le dernier jeudi de chaque mois soit sur des technos de la plateforme Microsoft (de l'éditeur ou de la communauté) ou sur des pratiques ou des outils.",
  "tags": [
    "Microsoft",
    "MUG",
    "pratiques",
    "outils",
    ".NET",
    "C#",
    "JavaScript"
  ],
  "patternsGoogleCalendar": [
    "MUG",
    "MTGLyon"
  ],
  "socialLinks": [
    {
      "url": "http://muglyon.github.io/"
    },
    {
      "url": "https://www.meetup.com/fr-FR/mtglyon/"
    },
    {
      "url": "https://www.twitter.com/muglyon"
    },
    {
      "url": "https://www.linkedin.com/groups/MUG-Lyon-4302523"
    },
    {
      "url": "https://www.github.com/muglyon"
    }
  ],
  "slackChannels": [
    "#muglyon"
  ]
}
