{
  "image": "hckrs.png",
  "name": "hckrs.io",
  "shortDescription": "Communaut√© locale de bidouilleurs.",
  "tags": [
    "Developpement",
    "Design",
    "Hardware",
    "Growth hacking",
    "Life Hacking"
  ],
  "socialLinks": [
    {
      "icon": "link",
      "tooltip": "Web site",
      "url": "http://hckrs.io/+/-__----"
    },
    {
      "icon": "twitter",
      "tooltip": "Twitter",
      "url": "http://www.twitter.com/hckrslyon"
    },
    {
      "icon": "github",
      "tooltip": "Git Hub Organization",
      "url": "https://github.com/hckrs/hckrs.io"
    }
  ],
  "patternsGoogleCalendar": []
}
