{
  "image": "LyonJS.png",
  "name": "LyonJS",
  "shortDescription": "LyonJS ce sont des talks long format sur un sujet hype du moment, des lightnings talks pour vous faire découvrir autre chose, le tout suivi d'un apéro pour se rencontrer et discuter tous ensemble.",
  "tags": [
    "JavaScript",
    "JS",
    "Angular",
    "Node.JS"
  ],
  "patternsGoogleCalendar": [
    "LyonJS"
  ],
  "socialLinks": [
    {
      "url": "http://lyonjs.org/"
    },
    {
      "url": "https://twitter.com/LyonJS"
    },
    {
      "url": "https://github.com/lyonjs"
    },
    {
      "url": "https://www.youtube.com/channel/UCGTVc5PnIgAUoA2D2_6nJLg"
    }
  ]
}
